Sheet: Ha æbler per region
A3: Æblesorter | B3: Region Hovedstaden | C3: Region Sjælland | D3: Region Syddanmark | E3: Region Midtjylland | F3: Region Nordjylland | G3: Hele landet
A4: Elstar | B4: 5 | C4: 73 | D4: 119 | E4: 29 | F4: 5 | G4: 230
A5: Ingrid Marie | B5: 8 | C5: 37 | D5: 82 | E5: 10 | F5: 3 | G5: 139
A6: Pærer | B6: 15 | C6: 113 | D6: 154 | E6: 34 | F6: 7 | G6: 323
A7: Økologiske æbler | B7: 83 | C7: 132 | D7: 200 | E7: 0 | F7: 0 | G7: 467
A8: Økologiske pærer | B8: 0 | C8: 0 | D8: 0 | E8: 0 | F8: 0 | G8: 51
A9: Alle æbler | B9: 114 | C9: 407 | D9: 587 | E9: 137 | F9: 40 | G9: 1285

Sheet: Træers alder og sorter 2023
A1: Æblesorter | B1: 1-4 år | C1: 5-9 år | D1: 10-14 år | E1: 15-24 år | F1: 25 år og derover | G1: I alt | H1: Træer pr. ha | I1: Træer i alt
A2: Aroma | B2: 8 | C2: 14 | D2: 27 | E2: 31 | F2: 2 | G2: of:=SUM([.B2:.F2]) -> 82 | H2: 1979 | I2: of:=[.G2]*[.H2] -> 162278
A3: Belle de Boskoop | B3: 12 | C3: 5 | D3: 4 | E3: 5 | F3: 6 | G3: of:=SUM([.B3:.F3]) -> 32 | H3: 1036 | I3: of:=[.G3]*[.H3] -> 33152
A4: Belida | B4: 3 | C4: 4 | D4: 3 | E4: 6 | F4: 1 | G4: of:=SUM([.B4:.F4]) -> 17 | H4: 2065 | I4: of:=[.G4]*[.H4] -> 35105
A5: Cox orange | B5: 2 | C5: 2 | D5: 5 | E5: 15 | F5: 7 | G5: of:=SUM([.B5:.F5]) -> 31 | H5: 1729 | I5: of:=[.G5]*[.H5] -> 53599
A6: Discovery | B6: 9 | C6: 7 | D6: 19 | E6: 24 | F6: 12 | G6: of:=SUM([.B6:.F6]) -> 71 | H6: 1471 | I6: of:=[.G6]*[.H6] -> 104441
A7: Elstar | B7: 49 | C7: 27 | D7: 65 | E7: 81 | F7: 8 | G7: of:=SUM([.B7:.F7]) -> 230 | H7: 2214 | I7: of:=[.G7]*[.H7] -> 509220
A8: Gala | B8: 0 | C8: 1 | D8: 2 | E8: 7 | F8: 0 | G8: of:=SUM([.B8:.F8]) -> 10 | H8: 2511 | I8: of:=[.G8]*[.H8] -> 25110
A9: Gråsten | B9: 1 | C9: 2 | D9: 4 | E9: 15 | F9: 5 | G9: of:=SUM([.B9:.F9]) -> 27 | H9: 1666 | I9: of:=[.G9]*[.H9] -> 44982
A10: Holsteiner cox | B10: 14 | C10: 3 | D10: 8 | E10: 24 | F10: 2 | G10: of:=SUM([.B10:.F10]) -> 51 | H10: 1775 | I10: of:=[.G10]*[.H10] -> 90525
A11: Ingrid Marie | B11: 28 | C11: 9 | D11: 41 | E11: 45 | F11: 16 | G11: of:=SUM([.B11:.F11]) -> 139 | H11: 1955 | I11: of:=[.G11]*[.H11] -> 271745
A12: Junami | B12: 14 | C12: 51 | D12: 15 | E12: 2 | F12: 0 | G12: of:=SUM([.B12:.F12]) -> 82 | H12: 2772 | I12: of:=[.G12]*[.H12] -> 227304
A13: Jonagold | B13: 10 | C13: 5 | D13: 15 | E13: 27 | F13: 5 | G13: of:=SUM([.B13:.F13]) -> 62 | H13: 2199 | I13: of:=[.G13]*[.H13] -> 136338
A14: Pigeon | B14: 2 | C14: 0 | D14: 3 | E14: 4 | F14: 2 | G14: of:=SUM([.B14:.F14]) -> 11 | H14: 1512 | I14: of:=[.G14]*[.H14] -> 16632
A15: Rubens | B15: 0 | C15: 0 | D15: 7 | E15: 1 | F15: 0 | G15: of:=SUM([.B15:.F15]) -> 8 | H15: 2904 | I15: of:=[.G15]*[.H15] -> 23232
A16: Summerred | B16: 0 | C16: 2 | D16: 3 | E16: 1 | F16: 0 | G16: of:=SUM([.B16:.F16]) -> 6 | H16: 1793 | I16: of:=[.G16]*[.H16] -> 10758
A17: Mutzu | B17: 0 | C17: 0 | D17: 1 | E17: 1 | F17: 2 | G17: of:=SUM([.B17:.F17]) -> 4 | H17: 1256 | I17: of:=[.G17]*[.H17] -> 5024
A18: Filippa | B18: 4 | C18: 3 | D18: 4 | E18: 2 | F18: 4 | G18: of:=SUM([.B18:.F18]) -> 17 | H18: 764 | I18: of:=[.G18]*[.H18] -> 12988
A19: Topaz | B19: 11 | C19: 6 | D19: 4 | E19: 3 | F19: 0 | G19: of:=SUM([.B19:.F19]) -> 24 | H19: 1674 | I19: of:=[.G19]*[.H19] -> 40176
A20: Santana | B20: 0 | C20: 0 | D20: 2 | E20: 6 | F20: 0 | G20: of:=SUM([.B20:.F20]) -> 8 | H20: 2548 | I20: of:=[.G20]*[.H20] -> 20384
A21: Zari | B21: 3 | C21: 1 | D21: 0 | E21: 0 | F21: 0 | G21: of:=SUM([.B21:.F21]) -> 4 | H21: 3019 | I21: of:=[.G21]*[.H21] -> 12076
A22: Ahrista | B22: 1 | C22: 3 | D22: 2 | E22: 1 | F22: 0 | G22: of:=SUM([.B22:.F22]) -> 7 | H22: 1375 | I22: of:=[.G22]*[.H22] -> 9625
A23: Alkemene | B23: 1 | C23: 3 | D23: 0 | E23: 0 | F23: 0 | G23: of:=SUM([.B23:.F23]) -> 4 | H23: 1686 | I23: of:=[.G23]*[.H23] -> 6744
A24: Maribelle | B24: 1 | C24: 5 | D24: 0 | E24: 0 | F24: 0 | G24: of:=SUM([.B24:.F24]) -> 6 | H24: 2374 | I24: of:=[.G24]*[.H24] -> 14244
A25: Rubinola | B25: 10 | C25: 2 | D25: 1 | E25: 3 | F25: 0 | G25: of:=SUM([.B25:.F25]) -> 16 | H25: 1270 | I25: of:=[.G25]*[.H25] -> 20320
A26: Rubinstep/Pirouette | B26: 2 | C26: 7 | D26: 0 | E26: 7 | F26: 0 | G26: of:=SUM([.B26:.F26]) -> 16 | H26: 2474 | I26: of:=[.G26]*[.H26] -> 39584
A27: Elise | B27: 4 | C27: 0 | D27: 3 | E27: 1 | F27: 0 | G27: of:=SUM([.B27:.F27]) -> 8 | H27: 1820 | I27: of:=[.G27]*[.H27] -> 14560
A28: Andre æbler | B28: 66 | C28: 68 | D28: 59 | E28: 77 | F28: 0 | G28: of:=SUM([.B28:.F28]) -> 270 | H28: 1164 | I28: of:=[.G28]*[.H28] -> 314280
A29: Pærer | B29: 58 | C29: 51 | D29: 85 | E29: 85 | F29: 39 | G29: of:=SUM([.B29:.F29]) -> 318 | H29: 1927 | I29: of:=[.G29]*[.H29] -> 612786
A30: Alle æbler | B30: 1285 | C30: 254 | D30: 298 | E30: 389 | F30: 44